{
  "$schema": "paper-rig/attachment-module-1",
  "schemaVersion": "1.1.0",
  "id": "simpleHorn",
  "compatibleSlotTypes": ["head.horn"],
  "attachmentFrame": {
    "positionMeters": [0, 0, 0.012],
    "rotationXYZDegrees": [0, 0, 0]
  },
  "mountInterface": {
    "type": "overlap-gasket",
    "axis": "+z",
    "radiusMeters": 0.05,
    "embedDepthMeters": 0.012,
    "compositing": "module-over-owner"
  },
  "bounds": {
    "centerMeters": [0, 0, 0.11],
    "sizeMeters": [0.11, 0.11, 0.33]
  },
  "paletteRoles": ["body.horn"],
  "geometry": {
    "joints": [
      {
        "id": "root",
        "parent": null,
        "bind": [0, 0, 0],
        "role": "module-root"
      },
      {
        "id": "tip",
        "parent": "root",
        "bind": [0, 0, 0.22],
        "role": "module-shape"
      }
    ],
    "plates": [
      {
        "id": "body",
        "bone": "tip",
        "shape": "taperedBone",
        "size": [0.11],
        "role": "horn",
        "bodyRegion": "accessory",
        "semanticDetailTier": "identity",
        "attachment": "rigid",
        "material": "paperShade",
        "paletteRole": "body.horn",
        "zBias": 6.2,
        "span": ["root", "tip"],
        "jointOverlap": 1.08
      }
    ]
  }
}
