{
  "$schema": "paper-rig/attachment-module-1",
  "schemaVersion": "1.0.0",
  "id": "simpleHat",
  "compatibleSlotTypes": ["head.hat"],
  "attachmentFrame": {
    "positionMeters": [0, 0, 0],
    "rotationXYZDegrees": [0, 0, 0]
  },
  "bounds": {
    "centerMeters": [0, 0, 0.06],
    "sizeMeters": [0.22, 0.22, 0.34]
  },
  "paletteRoles": ["equipment"],
  "geometry": {
    "joints": [
      {
        "id": "root",
        "parent": null,
        "bind": [0, 0, 0],
        "role": "module-root"
      },
      {
        "id": "crown",
        "parent": "root",
        "bind": [0, 0, 0.12],
        "role": "module-shape"
      }
    ],
    "plates": [
      {
        "id": "body",
        "bone": "crown",
        "shape": "bone",
        "size": [0.22],
        "role": "equipment",
        "bodyRegion": "accessory",
        "attachment": "rigid",
        "material": "equipmentLeather",
        "paletteRole": "equipment",
        "zBias": 6.1,
        "span": ["root", "crown"],
        "jointOverlap": 1.08
      }
    ]
  }
}
